expens_code,expens_name
K0100,ค่าใช้จ่ายสิ้นเปลืองป้องกัน COVID19
K0101,ค่าที่ปรึกษา-งานวิจัยและพัฒนา
K0171,ค่าที่ปรึกษา-ความเป็นไปได้
R0001,กำไร(ขาดทุน)จากการจำหน่ายทรัพย์สิน
R0002,กำไร(ขาดทุน)จากภาษีสรรพากร
R0003,เงินเดือนพนักงาน
R0004,ค่าแรงรายวัน DC
R0006,"ค่าฝึกอบรม,สัมมนาและโฆษณารับสมัครงาน"
R0007,ค่าประกันสังคมส่วนบริษัท
R0008,ค่าชุดยูนิฟอร์มพนักงาน
R0009,เงินสมทบกองทุนสำรองเลี้ยงชีพ - ส่วนบริษัท (ส่วนกลาง)
R0010,เงินสมทบกองทุนทดแทน
R0011,เงินเดือน Spare Part
R0012,ค่าที่ปรึกษา
R0014,"ค่าสวัสดิการ (ประกันกลุ่ม ,สวัสดิการอื่น)"
R0015,เงินสมทบพัฒนาฝีมือแรงงาน
R0016,เงินสมทบกองทุนพัฒนาคนพิการ
R0017,ค่าแรงรายวัน DC - Precast
R0018,ค่าใช้จ่ายผลประโยชน์หลังเกษียณอายุ-พนักงาน
R0019,ค่าแรงงานฝึกงาน
R0020,ค่าไฟฟ้า
R0021,ค่าน้ำประปา
R0022,ค่าโทรศัพท์
R0023,"ค่ากระดาษ เครื่องเขียน,นามบัตร,หนังสือพิมพ์,คัดหนังสือ,EMS,ต่ออายุ"
R0024,ค่ารปภ.
R0025,"ค่าเช่า, บริการ เครื่องถ่ายเอกสารของส่วนกลาง"
R0026,ค่าบริการทำความสะอาด (แม่บ้าน)
R0027,ค่าวัสดุสิ้นเปลืองสำนักงาน(กระดาษชำระ ก้อนดับกลิ่นประเภทของใช้)
R0028,"ค่าบริการอื่น (กำจัดปลวก, เก็บขยะ หรืออื่นๆ ที่เป็นส่วนกลาง)"
R0029,"ค่าใช้จ่ายเบ็ดเตล็ดสำนักงาน (กาแฟ,น้ำดื่ม,ถุงขยะ,พวงมาลัย,ของไหว้,)"
R0030,"ค่าเบี้ยประกันภัยอาคาร,บ้านพัก"
R0031,"ค่าเช่าที่ดิน,ค่าบริการเพื่อให้ได้มาที่ดิน"
R0032,ค่าเช่าสำนักงาน
R0033,ค่าน้ำมันยานพาหนะ
R0034,ค่าทางด่วนและค่าที่จอดรถ
R0035,"ค่าเดินทางและที่พักในและต่างประเทศ (TAXI ,ค่ารถ,ตั๋วเครื่องบิน,ที่พัก)"
R0036,ค่าเบี้ยประกันภัยยานพาหนะ
R0037,"ค่าพรบ.,ค่าภาษีและจดทะเบียนยานพาหนะ"
R0038,"ค่าซ่อมแซมและบำรุงรักษายานพาหนะ,เปลี่ยนอะไหล่,วัสดุสิ้นเปลือง"
R0039,"ค่ายาง (รถเทเลอร์,รถบรรทุก,รถยนต์)"
R0040,"ค่าใช้จ่ายอื่นยานพาหนะ (ค่าชั่งน้ำหนัก,ค่าผ่านทาง)"
R0041,"ค่าถ่ายเอกสาร,ถ่ายแบบ,พิมพ์เขียว "
R0042,ค่าซื้อแบบ
R0043,ค่าเย็บเล่ม
R0044,"ค่าเดินทางชี้แจงแบบ,ส่งเอกสาร (รวมวินมอร์เตอร์ไซด์)TAXI"
R0045,ค่าจ้างออกแบบ BIM
R0046,ค่าซ่อมบำรุง ปรับปรุงอาคาร
R0047,ค่าเบี้ยประกันภัยอาคาร
R0048,ค่าใช้จ่ายปรับปรุงซ่อมทรัพย์สินบริษัท รวมเฟอร์นิเจอร์ ค่าตกแต่งคอนโด
R0049,"ค่านายหน้า "
R0050,"ค่าส่วนกลาง,ค่าสาธารณูปโภค (ทรัพย์สินบริษัท)"
R0051,ค่าบริหารงาน
R0052,ค่าซ่อมบำรุงอุปกรณ์ เครื่องใช้สำนักงาน
R0053,"ค่าซ่อมแซมบำรุงรักษา -ทาวเวอร์เครน,เดอริกเครน"
R0054,ค่าซ่อมแซมและบำรุงรักษา -PASSENGER LIFT และอะไหล่ลิฟท์
R0055,ค่าซ่อมแซมและบำรุงรักษา-นั่งร้านและอุปกรณ์ประกอบนั่งร้าน
R0056,ค่าซ่อมแซมบำรุงรักษา -เครื่องมือและอุปกรณ์ก่อสร้าง
R0057,"ค่าเช่าและบริการ เครืองจักร,เครื่องมือ,passenger Lift ,อุปกรณ์,ยานหนะ"
R0058,ค่าวัสดุอุปกรณ์ (เครื่องมือเล็กๆ )ใช้ในการทำงาน
R0059,ค่าซ่อมแซมบำรุงรักษา -อาคารสำนักงาน
R0060,เงินบริจาค
R0061,"ค่าใช้จ่ายเกี่ยวกับรถยนต์ผู้บริหาร(น้ำมัน,บำรุงรักษา,ประกันภัย)"
R0062,"ค่ารับรอง,ค่ากระเช้า,ของขวัญ"
R0063,"ค่าโฆษณาประชาสัมพันธ์ ,ส่งเสริมการขาย"
R0064,"ค่าธรรมเนียมโอนเงิน,ซื้อเช็ค,เช็คคืน"
R0065,"ค่าธรรมเนียมLG,BD,PB, Advance,RET, อาวัล"
R0066,ค่าอากรแสตมป์
R0067,"ค่าตรวจสอบ,รับรอง,ที่ปรึกษาบัญชี,ค่าที่ปรึกษานักคณิตศาสตร์"
R0068,ดอกเบี้ยจ่ายตามสัญญาเช่าซื้อ
R0069,"ค่าภาษีโรงเรือนและที่ดิน,ภาษีป้ายต่างๆ"
R0070,"ดอกเบี้ยจ่ายเบิกเกินบัญชี,ดอกเบี้ยกู้ยืม,ด.บ PN  ด.บ ต่างๆ"
R0071,ค่าวิศวกรควบคุมงานต่างๆ
R0072,ค่าเบี้ยปรับเงินเพิ่ม
R0073,ค่าวัสดุก่อสร้าง(ส่วนเพิ่ม)
R0074,ค่าใช้จ่ายคดีความ
R0075,"ค่าประเมิน,ค่าโอน,ค่าจดจำนอง"
R0076,"ค่าใช้จ่ายอื่นไปดำเนินการ(ค่าเดินทาง,ค่าคัดเอกสาร,ค่าที่พัก,ประสานงาน)"
R0077,ค่าที่ปรึกษางานกฎหมาย
R0078,CSRค่าใช้จ่ายเพื่อสังคมและสิ่งแวดล้อม
R0079,"ค่าใช้จ่ายดูแลส่วนงานภายนอก,ค่าธรรมเนียมคนงาน"
R0080,ค่าวัสดุเก็บงาน
R0081,ค่าจ้างเหมาเก็บงาน (ผูัรับเหมา)
R0082,ค่าเสื่อมราคา- อาคาร
R0083,ค่าเสื่อมราคา -ทาวเวอร์เครน
R0084,ค่าเสื่อมราคา -ลิฟท์ Passenger
R0085,ค่าเสื่อมราคา -นั่งร้านและอุปกรณ์
R0086,ค่าเสื่อมราคา -เครื่องมือและอุปกรณ์ก่อสร้าง
R0087,ค่าเสื่อมราคา -เครื่องตกแต่งและเครื่องใช้สำนักงาน
R0088,"ค่าเสื่อมราคา -ยานพาหนะ,รถยนต์,รถกระบะ รถบรรทุก"
R0089,ค่าเสื่อมราคา -ค่าลิขสิทธิ์ซอฟแวร์
R0090,ค่าเสื่อมราคา-เครื่องมือและอุปกรณ์ทุกชนิดปล่อยเช่า
R0091,ค่าเสื่อมราคา -คอมพิวเตอร์และอุปกรณ์
R0092,ค่าเสื่อมราคา -อาคารคอนโด เพื่อการลงทุน
R0093,ค่าที่ปรึกษา -ความเป็นไปได้
R0094,ค่าเบี้ยประชุม
R0095,ค่าตอบแทนกรรมการอื่น
R0097,เงินปันผล
R0098,"ค่าใช้จ่ายไม่มีใบเสร็จ (ไม่มีใบเสร็จ,บิลไม่ถูกต้อง)"
R0099,ค่าอำนวยความสะดวก
R0100,ค่าเบี้ยปรับเงินเพิ่ม
R0101,ค่าภาษีซื้อที่ขอคืนไม่ได้
R0102,"ค่าภาษีนิติบุคคล (เครดิตภาษีที่ไม่รับคืน) ภาษีไม่ขอคืน,ภาษีที่บ.ออกให้"
R0103,ค่าวัสดุส่วนเพิ่ม
R0104,หนี้สงสัยจะสูญ
